{
    "$schema":    "../plugin.schema.json",
    "id":          "core-altered-cards",
    "name":        "Altered Cards",
    "version":     "1.1.2",
    "description": "Cards browser, deck builder and collection manager for Altered TCG",
    "author":      "AlteredCore",
    "icon":        "fa-solid fa-layer-group",
    "table_prefix": "cac",

    "assets": {
        "css": ["assets/style.css"]
    },

    "pages": [
        {"slug": "cards",       "file": "pages/cards.php",       "title_en": "Cards",         "title_fr": "Cartes"},
        {"slug": "card",        "file": "pages/card.php",        "title_en": "Card",          "title_fr": "Carte"},
        {"slug": "deckbuilder", "file": "pages/deckbuilder.php", "title_en": "Deck Builder",  "title_fr": "Créateur de deck"},
        {"slug": "deck",        "file": "pages/deck.php",        "title_en": "Deck",          "title_fr": "Deck"},
        {"slug": "decks",       "file": "pages/decks.php",       "title_en": "Decks",         "title_fr": "Decks"},
        {"slug": "collection",  "file": "pages/collection.php",  "title_en": "Collection",    "title_fr": "Collection"},
        {"slug": "playset",     "file": "pages/playset.php",     "title_en": "Physical Playset", "title_fr": "Playset physique"},
        {"slug": "bgatester",   "file": "pages/bgatester.php",   "title_en": "Test Team",     "title_fr": "Équipe de tests"}
    ],

    "api": [
        {"endpoint": "collection-search", "file": "api/collection-search.php"},
        {"endpoint": "ownership-search",  "file": "api/ownership-search.php"},
        {"endpoint": "playset",           "file": "api/playset.php"},
        {"endpoint": "playset-cards",     "file": "api/playset-cards.php"},
        {"endpoint": "favorites-search",  "file": "api/favorites-search.php"},
        {"endpoint": "favorites-toggle",  "file": "api/favorites-toggle.php"},
        {"endpoint": "deck-add-card",     "file": "api/deck-add-card.php"},
        {"endpoint": "deck-alt-arts",     "file": "api/deck-alt-arts.php"},
        {"endpoint": "deck-image",        "file": "api/deck-image.php",  "methods": ["GET", "HEAD", "POST"]},
        {"endpoint": "deck-oembed",       "file": "api/deck-oembed.php", "methods": ["GET", "HEAD"]}
    ],

    "admin": [
        {
            "section":  "altered-json",
            "file":     "admin/altered-json.php",
            "label_en": "Altered JSON",
            "label_fr": "Altered JSON",
            "icon":     "fa-solid fa-code"
        }
    ],

    "sql":    "sql/install.sql",
    "tables": ["favorites"]
}
